{
  "project_id": "123e4567-e89b-12d3-a456-426614174000",
  "overall": 78.5,
  "budget": 43.3,
  "schedule": 45.7,
  "safety": 100.0,
  "quality": 95.0,
  "as_of": "2025-10-30T22:30:00Z",
  "calc_version": "v1.0",
  "inputs_snapshot": {
    "budget_total": 15000000,
    "budget_spent": 8500000,
    "budget_remaining": 6500000,
    "schedule_days_total": 532,
    "schedule_days_elapsed": 289,
    "schedule_days_remaining": 243,
    "safety_incidents_count": 0,
    "quality_defects_count": 1
  },
  "inputs_hash": "a1b2c3d4e5f6g7h8i9j0k1l2m3n4o5p6q7r8s9t0u1v2w3x4y5z6a7b8c9d0e1f2",
  "weights": {
    "budget": 0.3,
    "schedule": 0.3,
    "safety": 0.25,
    "quality": 0.15
  },
  "trace_id": "trace_health_001",
  "calculation_duration_ms": 45
}